{
  "request_id": "5b9086aa-d251-4b68-b8d4-03c53f2cc454",
  "audio_handle": "9c9b843e-4fc9-4424-af66-b3756d8bb248",
  "received_at": "2026-07-31T01:00:00Z",
  "terminal_at": "2026-07-31T01:00:09Z",
  "access_revoked_at": "2026-07-31T01:00:09Z",
  "deletion_completed_at": "2026-07-31T01:00:11Z",
  "delete_deadline_at": "2026-07-31T02:00:00Z",
  "status": "deleted"
}

